{
  "id": "8f434346",
  "title": "T",
  "summary": "S",
  "url": "https://example.com/foo",
  "source": "x",
  "fetched_at": "2023-01-01T00:00:00",
  "raw": {"content": "hi"},
  "hash": "8f434346648f6b96df89dda901c5176b10a6d83961dd3c1ac88b59b2dc327aa4",
  "classification": "OFFICIAL",
  "provenance": {
    "url": "https://example.com/foo",
    "fetched_at": "2023-01-01T00:00:00",
    "content_hash": "8f434346648f6b96df89dda901c5176b10a6d83961dd3c1ac88b59b2dc327aa4",
    "connector": "x"
  }
}
